{
  "id": "f1_early_checkin_ask",
  "category": "F",
  "card": "understand",
  "input": {
    "today": "2026-10-25",
    "stage": "ordered",
    "brief": {
      "origin": {
        "city": "Москва",
        "iata": [
          "SVO",
          "VKO",
          "DME"
        ]
      },
      "destination": {
        "id": "antalya",
        "name": "Анталья",
        "country": "Турция"
      },
      "traits": null,
      "dates": {
        "start": "2026-11-14",
        "end": "2026-11-21",
        "month": 11,
        "window": null,
        "nights": 7,
        "flexible_days": 0
      },
      "party": {
        "segment": "family",
        "adults": 2,
        "children": 1,
        "children_ages": [
          4
        ],
        "pets": []
      },
      "budget_rub": null,
      "scope": null,
      "prefs": {
        "meals": "all_inclusive",
        "free_cancellation": null,
        "stars_min": null,
        "direct_only": null,
        "max_travel_hours": null,
        "district": "any",
        "beach_max_m": null,
        "transport": "any"
      },
      "constraints": null,
      "mood": null
    },
    "assumed": [],
    "assumptions": [],
    "shown": [],
    "pending_questions": [],
    "history": [
      {
        "role": "agent",
        "text": "Оплачено, всё подтверждено!"
      }
    ],
    "message": "можно заселиться пораньше? мы прилетаем почти в час дня",
    "has_image": false
  },
  "image": null,
  "expect": [
    {
      "type": "schema"
    },
    {
      "type": "path_equals",
      "path": "/intent",
      "value": "post_purchase"
    },
    {
      "type": "path_equals",
      "path": "/post_purchase/kind",
      "value": "early_checkin"
    },
    {
      "type": "predicate",
      "name": "patch_empty"
    }
  ],
  "runs": 5,
  "notes": "Entry F from the plan."
}
