{
  "id": "e8_refine_near_hagia_sophia",
  "category": "E",
  "card": "understand",
  "input": {
    "today": "2026-10-25",
    "stage": "selection",
    "brief": {
      "origin": {
        "city": "Москва",
        "iata": [
          "SVO",
          "VKO",
          "DME"
        ]
      },
      "destination": {
        "id": "istanbul",
        "name": "Стамбул",
        "country": "Турция"
      },
      "traits": null,
      "dates": {
        "start": "2026-12-01",
        "end": "2026-12-05",
        "month": 12,
        "window": null,
        "nights": 4,
        "flexible_days": 0
      },
      "party": {
        "segment": "couple",
        "adults": 2,
        "children": 0,
        "children_ages": null,
        "pets": []
      },
      "budget_rub": null,
      "scope": null,
      "prefs": {
        "meals": "any",
        "free_cancellation": null,
        "stars_min": null,
        "direct_only": null,
        "max_travel_hours": null,
        "district": "any",
        "beach_max_m": null,
        "transport": "any"
      },
      "constraints": null,
      "mood": null
    },
    "assumed": [
      "origin.city"
    ],
    "assumptions": [
      {
        "field": "origin.city",
        "label": "из Москвы"
      }
    ],
    "shown": [
      {
        "label": "1",
        "kind": "variant",
        "id": "cheapest",
        "title": "Дешевле"
      },
      {
        "label": "2",
        "kind": "variant",
        "id": "fastest",
        "title": "Быстрее"
      },
      {
        "label": "3",
        "kind": "variant",
        "id": "comfort",
        "title": "Комфортнее"
      }
    ],
    "pending_questions": [],
    "history": [],
    "message": "Отель тот же, 2,5 км от центра. Есть что-то рядом с Айя-Софией?",
    "has_image": false
  },
  "image": null,
  "expect": [
    {
      "type": "schema"
    },
    {
      "type": "path_in",
      "path": "/intent",
      "values": [
        "refine",
        "info"
      ]
    },
    {
      "type": "path_in",
      "path": "/patch/set/prefs.center_max_m",
      "values": [
        800,
        1500
      ]
    },
    {
      "type": "path_absent",
      "path": "/patch/set/prefs.district"
    }
  ],
  "runs": 5,
  "notes": "«рядом с Айя-Софией» = a sight of the historic centre -> prefs.center_max_m (L3 s04 t6).",
  "unsure": "info with the patch is accepted: route_intent / the update card still rebuild with the pref."
}
