{
  "id": "x1_impossible_budget",
  "category": "edge",
  "card": "present.variants",
  "input": {
    "today": "2026-10-25",
    "stage": "selection",
    "brief": {
      "origin": {
        "city": "Москва",
        "iata": [
          "SVO",
          "VKO",
          "DME"
        ]
      },
      "destination": {
        "id": "dubai",
        "name": "Дубай",
        "country": "ОАЭ"
      },
      "traits": null,
      "dates": {
        "start": "2026-12-05",
        "end": "2026-12-12",
        "month": 12,
        "window": null,
        "nights": 7,
        "flexible_days": 0
      },
      "party": {
        "segment": "couple",
        "adults": 2,
        "children": 0,
        "children_ages": null,
        "pets": []
      },
      "budget_rub": {
        "max": 15000
      },
      "scope": null,
      "prefs": {
        "meals": "any",
        "free_cancellation": null,
        "stars_min": null,
        "direct_only": null,
        "max_travel_hours": null,
        "district": "any",
        "beach_max_m": null,
        "transport": "any"
      },
      "constraints": null,
      "mood": null
    },
    "assumed": [],
    "assumptions": [],
    "items": [
      {
        "id": "cheapest",
        "label": "1",
        "title": "Дешевле",
        "totals": {
          "rub": 103200,
          "door_to_door_hours": 11.5
        },
        "steps": [
          {
            "type": "flight",
            "from": "VKO",
            "to": "DXB",
            "start": "2026-12-05T09:00+03:00",
            "end": "2026-12-05T15:10+03:00",
            "carrier": "Пример Эйр",
            "price_rub": 31400
          },
          {
            "type": "stay",
            "from": "Отель «Дейра Сити» (пример)",
            "to": "Отель «Дейра Сити» (пример)",
            "start": "2026-12-05T16:00+03:00",
            "end": "2026-12-12T12:00+03:00",
            "carrier": null,
            "price_rub": 42000
          },
          {
            "type": "flight",
            "from": "DXB",
            "to": "VKO",
            "start": "2026-12-12T17:00+03:00",
            "end": "2026-12-12T21:30+03:00",
            "carrier": "Пример Эйр",
            "price_rub": 29800
          }
        ],
        "hotel": {
          "name": "Отель «Дейра Сити» (пример)",
          "stars": 3,
          "rating": 7.9,
          "district": {
            "labels": [
              "walkable"
            ],
            "counts": {
              "bars": 3,
              "cafes": 9,
              "playgrounds": 1,
              "parks": 1
            }
          }
        },
        "facts": {
          "total_rub": 103200,
          "nights": 7,
          "budget_rub": 15000,
          "over_budget_rub": 88200
        },
        "sacrifices": [
          {
            "code": "over_budget",
            "text": "Дороже бюджета на 88 200 ₽",
            "data": {
              "over_rub": 88200
            }
          }
        ],
        "risks": [],
        "not_for": [],
        "fit": {
          "score": 0.2,
          "breakdown": {
            "price": 0.2,
            "time": 0.2
          }
        }
      },
      {
        "id": "fastest",
        "label": "2",
        "title": "Быстрее",
        "totals": {
          "rub": 130900,
          "door_to_door_hours": 10.4
        },
        "steps": [
          {
            "type": "flight",
            "from": "VKO",
            "to": "DXB",
            "start": "2026-12-05T09:00+03:00",
            "end": "2026-12-05T15:10+03:00",
            "carrier": "Пример Эйр",
            "price_rub": 36900
          },
          {
            "type": "stay",
            "from": "Отель «Марина Вок» (пример)",
            "to": "Отель «Марина Вок» (пример)",
            "start": "2026-12-05T16:00+03:00",
            "end": "2026-12-12T12:00+03:00",
            "carrier": null,
            "price_rub": 58800
          },
          {
            "type": "flight",
            "from": "DXB",
            "to": "VKO",
            "start": "2026-12-12T17:00+03:00",
            "end": "2026-12-12T21:30+03:00",
            "carrier": "Пример Эйр",
            "price_rub": 35200
          }
        ],
        "hotel": {
          "name": "Отель «Марина Вок» (пример)",
          "stars": 4,
          "rating": 8.5,
          "district": {
            "labels": [
              "walkable"
            ],
            "counts": {
              "bars": 3,
              "cafes": 9,
              "playgrounds": 1,
              "parks": 1
            }
          }
        },
        "facts": {
          "total_rub": 130900,
          "nights": 7,
          "budget_rub": 15000,
          "over_budget_rub": 115900
        },
        "sacrifices": [
          {
            "code": "over_budget",
            "text": "Дороже бюджета на 115 900 ₽",
            "data": {
              "over_rub": 115900
            }
          }
        ],
        "risks": [],
        "not_for": [],
        "fit": {
          "score": 0.15,
          "breakdown": {
            "price": 0.15,
            "time": 0.15
          }
        }
      }
    ],
    "recommended_hint": "cheapest",
    "questions": [],
    "upsell_candidates": []
  },
  "image": null,
  "expect": [
    {
      "type": "schema"
    },
    {
      "type": "ids_subset"
    },
    {
      "type": "numbers_subset"
    },
    {
      "type": "predicate",
      "name": "russian_only"
    },
    {
      "type": "predicate",
      "name": "tone_no_bureaucratese"
    },
    {
      "type": "predicate",
      "name": "at_most_one_joke"
    },
    {
      "type": "predicate",
      "name": "money_risks_plain"
    },
    {
      "type": "predicate",
      "name": "no_upsell_without_candidate"
    },
    {
      "type": "max_items",
      "path": "/upsell",
      "max": 2
    },
    {
      "type": "regex_absent",
      "path": "$text",
      "pattern": "вдвое|втрое|вчетверо|в полтора раза|в (два|три|четыре|\\d+) раза"
    },
    {
      "type": "regex_absent",
      "path": "$text",
      "pattern": "(?<![\\w-])(ты|тебе|тебя|тобой|твой|твоя|твоё|твои|твоих|твоим)(?![\\w-])"
    },
    {
      "type": "predicate",
      "name": "mentions_any",
      "args": {
        "words": [
          "бюджет",
          "дороже",
          "не уклад",
          "сверх",
          "превыш"
        ]
      }
    },
    {
      "type": "predicate",
      "name": "none_of",
      "args": {
        "assertions": [
          {
            "type": "predicate",
            "name": "mentions_any",
            "args": {
              "words": [
                "в рамках бюджета",
                "уложились",
                "укладывается в бюджет"
              ]
            }
          }
        ]
      }
    }
  ],
  "runs": 5,
  "notes": "15 000 ₽ for two to Dubai for a week cannot work: state the gap plainly with real numbers, never pretend."
}
