{
  "id": "t4_smalltalk_thanks",
  "category": "tone",
  "card": "present.fallback",
  "input": {
    "today": "2026-10-25",
    "stage": "selection",
    "brief": {
      "origin": {
        "city": "Москва",
        "iata": [
          "SVO",
          "VKO",
          "DME"
        ]
      },
      "destination": {
        "id": "sochi",
        "name": "Сочи",
        "country": "Россия"
      },
      "traits": null,
      "dates": {
        "start": "2026-11-12",
        "end": "2026-11-19",
        "month": 11,
        "window": null,
        "nights": 7,
        "flexible_days": 0
      },
      "party": {
        "segment": "couple",
        "adults": 2,
        "children": 0,
        "children_ages": null,
        "pets": []
      },
      "budget_rub": null,
      "scope": null,
      "prefs": {
        "meals": "any",
        "free_cancellation": null,
        "stars_min": null,
        "direct_only": null,
        "max_travel_hours": null,
        "district": "any",
        "beach_max_m": null,
        "transport": "any"
      },
      "constraints": null,
      "mood": null
    },
    "assumed": [],
    "assumptions": [],
    "message": "спасибо, ты лучший!",
    "reason": "smalltalk"
  },
  "image": null,
  "expect": [
    {
      "type": "schema"
    },
    {
      "type": "ids_subset"
    },
    {
      "type": "numbers_subset"
    },
    {
      "type": "predicate",
      "name": "russian_only"
    },
    {
      "type": "predicate",
      "name": "tone_no_bureaucratese"
    },
    {
      "type": "predicate",
      "name": "at_most_one_joke"
    },
    {
      "type": "predicate",
      "name": "money_risks_plain"
    },
    {
      "type": "predicate",
      "name": "no_upsell_without_candidate"
    },
    {
      "type": "max_items",
      "path": "/upsell",
      "max": 2
    },
    {
      "type": "regex_absent",
      "path": "$text",
      "pattern": "(?<!\\w)(?:вдвое|втрое|вчетверо|в полтора раза|в (два|три|четыре|\\d+) раза)(?!\\w)"
    },
    {
      "type": "regex_absent",
      "path": "$text",
      "pattern": "(?<![\\w-])(ты|тебе|тебя|тобой|твой|твоя|твоё|твои|твоих|твоим)(?![\\w-])"
    },
    {
      "type": "predicate",
      "name": "max_chars",
      "args": {
        "n": 400
      }
    },
    {
      "type": "max_items",
      "path": "/items",
      "max": 0
    }
  ],
  "runs": 5,
  "notes": "Smalltalk: short, warm, at most one joke, back to the trip."
}
