{
  "id": "p1_info_corgi_sapsan",
  "category": "F",
  "card": "present.info",
  "input": {
    "today": "2026-10-25",
    "stage": "selection",
    "brief": {
      "origin": {
        "city": "Москва",
        "iata": [
          "SVO",
          "VKO",
          "DME"
        ]
      },
      "destination": {
        "id": "saint-petersburg",
        "name": "Санкт-Петербург",
        "country": "Россия"
      },
      "traits": null,
      "dates": {
        "start": "2026-10-31",
        "end": "2026-11-01",
        "month": 10,
        "window": null,
        "nights": 1,
        "flexible_days": 0
      },
      "party": {
        "segment": "solo",
        "adults": 1,
        "children": 0,
        "children_ages": null,
        "pets": [
          "dog"
        ]
      },
      "budget_rub": null,
      "scope": null,
      "prefs": {
        "meals": "any",
        "free_cancellation": null,
        "stars_min": null,
        "direct_only": null,
        "max_travel_hours": null,
        "district": "any",
        "beach_max_m": null,
        "transport": "train"
      },
      "constraints": [
        "pet:dog",
        "train:sapsan"
      ],
      "mood": null
    },
    "assumed": [
      "origin.city"
    ],
    "assumptions": [
      {
        "field": "origin.city",
        "label": "из Москвы"
      }
    ],
    "question": "А с корги в Сапсан пустят? Какие правила для собак?",
    "facts": [
      {
        "kind": "variant",
        "id": "cheapest",
        "title": "Дешевле",
        "total_rub": 10680,
        "legs": [
          {
            "type": "train",
            "from": "Ленинградский вокзал",
            "to": "Московский вокзал",
            "carrier": "РЖД «Сапсан»",
            "dep_date": "2026-10-31",
            "dep_time": "06:25",
            "arr_date": "2026-10-31",
            "arr_time": "10:23",
            "price_rub": 4150,
            "duration_min": 238,
            "train_no": "751А",
            "car_class": "seat",
            "high_speed": true,
            "pets_rule": "В «Сапсане» — только в переноске до 180 см по сумме трёх сторон, на местах для пассажиров с животными; провоз 720 ₽; крупных собак не возят, кроме собак-проводников",
            "pet_fee_rub": 720
          },
          {
            "type": "train",
            "from": "Московский вокзал",
            "to": "Ленинградский вокзал",
            "carrier": "РЖД «Сапсан»",
            "dep_date": "2026-11-01",
            "dep_time": "09:20",
            "arr_date": "2026-11-01",
            "arr_time": "13:18",
            "price_rub": 3820,
            "duration_min": 238,
            "train_no": "752А",
            "car_class": "seat",
            "high_speed": true,
            "pets_rule": "В «Сапсане» — только в переноске до 180 см по сумме трёх сторон, на местах для пассажиров с животными; провоз 770 ₽; крупных собак не возят, кроме собак-проводников",
            "pet_fee_rub": 770
          }
        ],
        "stay": {
          "name": "Исаакиевская площадь",
          "check_in_date": "2026-10-31",
          "check_in_time": "14:00",
          "check_out_date": "2026-11-01",
          "check_out_time": "12:00",
          "pets_allowed": true
        },
        "price_pets_rub": 1490
      },
      {
        "kind": "pet_rules",
        "lines": [
          "В поездах РЖД кошек и небольших собак возят в закрытой переноске: сумма трёх её сторон — до 180 см, ставят её на место для ручной клади, на животное оформляют перевозочный документ, не больше двух животных на один билет.",
          "В скоростных поездах («Сапсан», «Ласточка») — только небольших животных в переноске и только на местах для пассажиров с животными; в экономе переноска до 180 см по сумме трёх сторон, в бизнес- и первом классе — до 120 см и до 10 кг вместе с переноской. Крупных собак в «Сапсане» не возят, кроме собак-проводников.",
          "В поездах дальнего следования крупную собаку везут только в отдельном купе: выкупают все свободные места, собака в наморднике и на поводке.",
          "Собаки-проводники едут бесплатно во всех вагонах."
        ]
      }
    ]
  },
  "image": null,
  "expect": [
    {
      "type": "schema"
    },
    {
      "type": "ids_subset"
    },
    {
      "type": "numbers_subset"
    },
    {
      "type": "predicate",
      "name": "russian_only"
    },
    {
      "type": "predicate",
      "name": "tone_no_bureaucratese"
    },
    {
      "type": "predicate",
      "name": "at_most_one_joke"
    },
    {
      "type": "predicate",
      "name": "money_risks_plain"
    },
    {
      "type": "predicate",
      "name": "no_upsell_without_candidate"
    },
    {
      "type": "max_items",
      "path": "/upsell",
      "max": 0
    },
    {
      "type": "predicate",
      "name": "max_chars",
      "args": {
        "n": 600
      }
    },
    {
      "type": "predicate",
      "name": "none_of",
      "args": {
        "assertions": [
          {
            "type": "predicate",
            "name": "admits_no_data"
          }
        ]
      }
    },
    {
      "type": "predicate",
      "name": "matches",
      "args": {
        "path": "/message",
        "pattern": "^\\W*Да\\b"
      }
    },
    {
      "type": "predicate",
      "name": "mentions_any",
      "args": {
        "words": [
          "переноск"
        ]
      }
    },
    {
      "type": "predicate",
      "name": "mentions_any",
      "args": {
        "words": [
          "180"
        ]
      }
    },
    {
      "type": "predicate",
      "name": "mentions_any",
      "args": {
        "path": "$text",
        "words": [
          "720",
          "720"
        ]
      }
    }
  ],
  "runs": 5,
  "notes": "h09 t2: the leg's pets_rule answers it — «да, в переноске до 180 см…» with the fee; no «нет данных», no size of the corgi the user never gave."
}
